{
  "observation_id": "vobs_alpha_binspill",
  "related_intake_id": "intake_alpha_2026",
  "observed_at": "2026-06-18T13:20:00Z",
  "observed_by": "consultant_a",
  "site_area": "small_parts_bins",
  "observation_type": "labeling",
  "description": "Multiple small-parts bins had faded or missing location labels, and several bins held mixed SKUs without partition labels.",
  "operational_implication": "Ambiguous bin identity makes accurate picking and counting difficult, contributing to the reported count-vs-ERP discrepancies.",
  "severity": "high",
  "suggested_follow_up": "Relabel affected bin zones and confirm one-SKU-per-location discipline; sample-count a labeled vs unlabeled zone to compare accuracy.",
  "evidence_references": ["evid_alpha_003"],
  "consultant_notes": "Photographed several bins; this looks like a strong quick-win candidate."
}
